"conference","year","doi","title","citationCount","download6weeks","download12months","downloadAll","keywords","pageNumber","authors"
"CHI","12","http://dx.doi.org/10.1145/2207676.2208296","Unlocking the expressivity of point lights","0 ","51","436","436","expressive; input/output devices; light behavior; user interfaces","10","Chris Harrison, Carnegie Mellon University, Pittsburgh, Pennsylvania, United States; John Horstman, Carnegie Mellon University, Pittsburgh, Pennsylvania, United States; Gary Hsieh, Michigan State University, East Lansing, Michigan, United States"
"CHI","12","http://dx.doi.org/10.1145/2207676.2208297","Virtual projection: exploring optical projection as a metaphor for multi-device interaction","2 ","82","595","595","handheld projection; mobile device","10","Dominikus Baur, University of Munich, Munich, Germany; Sebastian Boring, University of Calgary, Calgary, Alberta, Canada"
"CHI","12","http://dx.doi.org/10.1145/2207676.2208298","Creating and using interactive narratives: reading and writing branching comics","0 ","45","375","375","authoring; interactive narratives; multi-touch table; reading","10","Daniel Andrews, University of Birmingham, Birmingham, West Midlands, United Kingdom; Chris Baber, University of Birmingham, Birmingham, West Midlands, United Kingdom; Sergey Efremov, Moscow State Institute of Electronics and Mathematics, Moscow, Russia"
"CHI","12","http://dx.doi.org/10.1145/2207676.2208299","TimeBlocks: mom, can I have another block of time","0 ","47","321","321","interaction design for children; user interfaces","4","Eiji Hayashi, Carnegie Mellon University, Pittsburgh, Pennsylvania, United States; Martina Rau, Carnegie Mellon University, Pittsburgh, Pennsylvania, United States; Zhe Han Neo, Carnegie Mellon University, Pittsburgh, Pennsylvania, United States; Nastasha Tan, Carnegie Mellon University, Pittsburgh, Pennsylvania, United States; Sriram Ramasubramanian, Carnegie Mellon University, Pittsburgh, Pennsylvania, United States"
"CHI","12","http://dx.doi.org/10.1145/2207676.2208301","Rewarding the original: explorations in joint user-sensor motion spaces","0 ","50","333","333","gesture; motion; originality; user interfaces","10","John Williamson, University of Glasgow, Glasgow, United Kingdom"
"CHI","12","http://dx.doi.org/10.1145/2207676.2208302","Vignette: interactive texture design and manipulation with freeform gestures for pen-and-ink illustration","2 ","71","347","347","pen-and-ink illustration; texture design and manipulation","10","Rubaiat Habib Kazi, National University of Singapore &#38; JST ERATO Igarashi Design Interface Project, Singapore, Singapore; Takeo Igarashi, JST ERATO Igarashi Design Interface Project &#38; The University of Tokyo, Bunkyo, Tokyo, Japan; Shengdong Zhao, National University of Singapore, Singapore, Singapore"
"CHI","12","http://dx.doi.org/10.1145/2207676.2208303","Instructing people for training gestural interactive systems","2 ","58","503","503","data collection; machine learning; user interfaces","10","Simon Fothergill, University of Cambridge, Cambridge, United Kingdom; Helena Mentis, Microsoft Research, Cambridge, United Kingdom; Pushmeet Kohli, Microsoft Research, Cambridge, United Kingdom"
"CHI","12","http://dx.doi.org/10.1145/2207676.2208304","Making gestural input from arm-worn inertial sensors more practical","0 ","36","214","214","gesture recognition; implementation","4","Louis Kratz, Drexel University, Philadelphia, PA &#38; Microsoft Research, Redmond, WA, USA; Daniel Morris, Microsoft Research, Redmond, Washington, United States"
"CHI","12","http://dx.doi.org/10.1145/2207676.2208305","Clipoid: an augmentable short-distance wireless toolkit for 'accidentally smart home' environments","0 ","46","273","273","accidentally smart home; short-distance wireless connection; user interfaces","4","Jong-bum Woo, KAIST, Daejeon, Korea, Republic of"
"CHI","12","http://dx.doi.org/10.1145/2207676.2208307","""I'd never get out of this !?$%# office"": redesigning time management for the enterprise","0 ","56","334","334","calendar; miscellaneous; persuasive design; time management","10","Casey Dugan, IBM T.J. Watson Research, Cambridge, Massachusetts, United States; Werner Geyer, IBM T.J. Watson Research, Cambridge, Massachusetts, United States; Michael Muller, IBM T.J. Watson Research, Cambridge, Massachusetts, United States; Abel N. Valente, IBM Argentina, Buenos Aires, Argentina; Katherine James, Carnegie Mellon University, Pittsburgh, Pennsylvania, United States; Steve Levy, IBM T.J. Watson Research, Cambridge, Massachusetts, United States; Li-Te Cheng, IBM T.J. Watson Research, Cambridge, Massachusetts, United States; Elizabeth Daly, IBM T.J. Watson Research, Cambridge, Massachusetts, United States"
"CHI","12","http://dx.doi.org/10.1145/2207676.2208308","Do you see that I see?: effects of perceived visibility on awareness checking behavior","0 ","44","210","210","attention; cmc; group and organization interfaces","10","Jeremy Birnholtz, Cornell University &#38; University of Toronto, Ithaca, New York, United States; Nanyi Bi, Cornell University, Ithaca, New York, United States"
"CHI","12","http://dx.doi.org/10.1145/2207676.2208310","Best faces forward: a large-scale study of people search in the enterprise","2 ","41","202","202","enterprise search; large scale","10","Ido Guy, IBM Research, Haifa, Israel; Sigalit Ur, IBM Research, Haifa, Israel; Inbal Ronen, IBM Research, Haifa, Israel; Sara Weber, IBM CIO's Office, Cambridge, Massachusetts, United States"
"CHI","12","http://dx.doi.org/10.1145/2207676.2208311","The search dashboard: how reflection and comparison impact search behavior","1 ","55","314","314","experimentation; information search and retrieval; search expertise; web search","10","Scott Bateman, University of Saskatchewan, Saskatoon, Saskatchewan, Canada; Jaime Teevan, Microsoft Research, Redmond, Washington, United States"
"CHI","12","http://dx.doi.org/10.1145/2207676.2208312","Building the trail best traveled: effects of domain knowledge on web search trailblazing","0 ","43","212","212","domain knowledge; search behavior; search trails","10","Xiaojun Yuan, State University of New York, Albany, New York, United States"
"CHI","12","http://dx.doi.org/10.1145/2207676.2208314","Digging in the crates: an ethnographic study of DJS' work","0 ","51","241","241","djs; metadata; performance; social and behavioral sciences","10","Ahmed Ahmed, University of Nottingham, Nottingham, United Kingdom; Steve Benford, University of Nottingham, Nottingham, United Kingdom"
"CHI","12","http://dx.doi.org/10.1145/2207676.2208315","Becoming-sound: affect and assemblage in improvisational digital music making","0 ","47","215","215","affect; improvisation; music making","10",""
"CHI","12","http://dx.doi.org/10.1145/2207676.2208316","Interactive paper substrates to support musical creation","1 ","49","216","216","computer-aided composition; musical creation; tangible user interfaces","4","J&#233;r&#233;mie Garcia, INRIA &#38; Univ Paris-Sud &#38; IRCAM, Orsay, France; Theophanis Tsandilas, INRIA &#38; Univ Paris-Sud, Orsay, France; Carlos Agon, IRCAM, Paris, France"
"CHI","12","http://dx.doi.org/10.1145/2207676.2208317","DiskPlay: in-track navigation on turntables","0 ","41","166","166","augemented reality; dj; tangible interface; user interfaces","4","Florian Heller, RWTH Aachen University, Aachen, Germany"
"CHI","12","http://dx.doi.org/10.1145/2207676.2208319","Claim mobile: when to fail a technology","0 ","40","186","186","braided communications; hci4d; miscellaneous; sms","10",""
"CHI","12","http://dx.doi.org/10.1145/2207676.2208320","mClerk: enabling mobile crowdsourcing in developing regions","1 ","64","318","318","digitization; microtasks; social issues","10","Aakar Gupta, University of Toronto, Toronto, Ontario, Canada; William Thies, Microsoft Research India, Bangalore, Karnataka, India; Edward Cutrell, Microsoft Research India, Bangalore, Karnataka, India"
"CHI","12","http://dx.doi.org/10.1145/2207676.2208322","Balancing exertion experiences","1 ","67","436","436","dynamic difficulty adjustment; exergame; handicap; jogging; sport; whole-body interaction","10","Florian Mueller, RMIT University &#38; The University of Melbourne, Melbourne, Australia &#38; Microsoft Research Asia, Beijing, China &#38; Stanford University, Stanford, CA, USA; Frank Vetere, The University of Melbourne, Melbourne, Australia; Martin Gibbs, The University of Melbourne, Melbourne, Australia; Darren Edge, Microsoft Research Asia, Beijing, Beijing, China; Stefan Agamanolis, Akron Children's Hospital, Akron, Ohio, United States"
"CHI","12","http://dx.doi.org/10.1145/2207676.2208323","The acute cognitive benefits of casual exergame play","0 ","57","298","298","affect; cognitive benefits; exergame","10","Yue Gao, University of Saskatchewan, Saskatoon, Saskatchewan, Canada"
"CHI","12","http://dx.doi.org/10.1145/2207676.2208324","Full-body motion-based game interaction for older adults","1 ","92","509","509","design; games; older adults","10","Kathrin Gerling, University of Saskatchewan, Saskatoon, Saskatchewan, Canada; Ian Livingston, Ubisoft Divertissements Inc., Montreal, Quebec, Canada; Lennart Nacke, UOIT, Oshawa, Ontario, Canada"
"CHI","12","http://dx.doi.org/10.1145/2207676.2208326","Successful classroom deployment of a social document annotation system","0 ","50","303","303","annotation; e-learning; hypertext","10","Sacha Zyto, Massachusetts Institute of Technology, Cambridge, Massachusetts, United States; David Karger, Massachusetts Institute of Technology, Cambridge, Massachusetts, United States"
"CHI","12","http://dx.doi.org/10.1145/2207676.2208327","Informal information gathering techniques for active reading","1 ","45","332","332","active reading; pen; touch","4","Ken Hinckley, Microsoft Research, Redmond, Washington, United States; Xiaojun Bi, Microsoft Research, Redmond, Washington, United States; Michel Pahud, Microsoft Research, Redmond, Washington, United States"
"CHI","12","http://dx.doi.org/10.1145/2207676.2208328","Toward a theory of interaction in mobile paper-digital ensembles","1 ","43","291","291","anoto; mobile; theory","4","Felix Heinrichs, Technische Universit&#228;t Darmstadt, Darmstadt, Germany; Daniel Schreiber, Technische Universit&#228;t Darmstadt, Darmstadt, Germany; Jochen Huber, Technische Universit&#228;t Darmstadt, Darmstadt, Germany"
"CHI","12","http://dx.doi.org/10.1145/2207676.2208330","Humantenna: using the body as an antenna for real-time whole-body interaction","1 ","73","481","481","body as antenna; user interfaces","10","Gabe Cohn, Microsoft Research, Redmond &#38; University of Washington, Seattle, Washington, United States; Daniel Morris, Microsoft Research, Redmond, Washington, United States; Shwetak Patel, Microsoft Research, Redmond &#38; University of Washington, Seattle, Washington, United States"
"CHI","12","http://dx.doi.org/10.1145/2207676.2208331","SoundWave: using the doppler effect to sense gestures","0 ","103","424","424","doppler; interaction technique","4","Sidhant Gupta, Microsoft Research, Redmond &#38; University of Washington, Seattle, Washington, United States; Daniel Morris, Microsoft Research, Redmond, Washington, United States; Shwetak Patel, Microsoft Research, Redmond &#38; University of Washington, Seattle, Washington, United States"
"CHI","12","http://dx.doi.org/10.1145/2207676.2208332","Your phone or mine?: fusing body, touch and device sensing for multi-user device-display interaction","0 ","59","322","322","accelerometers; miscellaneous; sensor fusion","4","Mahsan Rofouei, Microsoft Research, Redmond, Washington &#38; University of California, Los Angeles, Los Angeles, California, United States; Andrew Wilson, Microsoft Research, Redmond, Washington, United States; A.J. Brush, Microsoft Research, Redmond, Washington, United States"
"CHI","12","http://dx.doi.org/10.1145/2207676.2208333","IllumiShare: sharing any surface","0 ","59","366","366","children; person; remote play; task; video","10","Sasa Junuzovic, Microsoft Research, Redmond, Washington, United States; Kori Inkpen, Microsoft Research, Redmond, Washington, United States; Tom Blank, Microsoft Research, Redmond, Washington, United States"
"CHI","12","http://dx.doi.org/10.1145/2207676.2208334","Rock-paper-fibers: bringing physical affordance to mobile touch devices","0 ","58","320","320","gesture; malleable; optical fiber; tangible; user interfaces","4","Frederik Rudeck, Hasso Plattner Institute, Potsdam, Germany"
"CHI","12","http://dx.doi.org/10.1145/2207676.2208335","Shake'n'sense: reducing interference for overlapping structured light depth cameras","1 ","54","569","569","depth camera; kinect; reducing interference; user interfaces","4","D. Alex Butler, Microsoft Research, Cambridge, United Kingdom; Shahram Izadi, Microsoft Research, Cambridge, United Kingdom; Otmar Hilliges, Microsoft Research, Cambridge, United Kingdom; David Molyneaux, Lancaster University, Lancaster &#38; Microsoft Research, Cambridge, United Kingdom; Steve Hodges, Microsoft Research, Cambridge, United Kingdom"
"CHI","12","http://dx.doi.org/10.1145/2207676.2208337","Augmenting the scope of interactions with implicit and explicit graphical structures","0 ","40","204","204","exploratory design; instrumental interaction","10","Rapha&#235;l Hoarau, Universite de Toulouse &#38; ENAC-IRIT, Toulouse, France"
"CHI","12","http://dx.doi.org/10.1145/2207676.2208338","Taming wild behavior: the input observer for obtaining text entry and mouse pointing measures from everyday computer use","1 ","37","205","205","everyday; fitts' law; in the wild; text entry","10","Abigail Evans, University of Washington, Seattle, Washington, United States"
"CHI","12","http://dx.doi.org/10.1145/2207676.2208339","Dwell-and-spring: undo for direct manipulation","0 ","42","235","235","canceling; dwell; undo","10","Caroline Appert, Univ Paris-Sud &#38; CNRS, Orsay, France; Olivier Chapuis, Univ Paris-Sud &#38; CNRS, Orsay, France"
"CHI","12","http://dx.doi.org/10.1145/2207676.2208341","Bridging between organizations and the public: volunteer coordinators' uneasy relationship with social computing","0 ","50","250","250","group and organization interfaces; npo; volunteer coordination","10","Amy Voida, University of California, Irvine, Irvine, California, United States; Ellie Harmon, University of California, Irvine, Irvine, California, United States"
"CHI","12","http://dx.doi.org/10.1145/2207676.2208342","The labor practices of service mediation: a study of the work practices of food assistance outreach","0 ","39","158","158","e-government; group and organization interfaces; service systems","10","Lynn Dombrowski, University of California, Irvine, Irvine, California, United States; Amy Voida, University of California, Irvine, Irvine, California, United States; Gillian R. Hayes, University of California, Irvine, Irvine, CA, USA"
"CHI","12","http://dx.doi.org/10.1145/2207676.2208343","Socially computed scripts to support social problem solving skills","0 ","39","261","261","autism; design; human computation; social scripts","10","Fatima Boujarwah, Georgia Institute of Technology, Atlanta, Georgia, United States; Gregory Abowd, Georgia Institute of Technology, Atlanta, Georgia, United States"
"CHI","12","http://dx.doi.org/10.1145/2207676.2208344","Comparing collaboration and individual personas for the design and evaluation of collaboration software","1 ","43","247","247","collaboration personas; evaluation; miscellaneous; user study","4","Tejinder Judge, Google Inc., Mountain View, California, United States; Tara Matthews, IBM Research - Almaden, San Jose, California, United States"
"CHI","12","http://dx.doi.org/10.1145/2207676.2208345","TEROOS: a wearable avatar to enhance joint activities","0 ","47","310","310","avatar communication; group and organization interfaces; social response","4","Tadakazu Kashiwabara, Keio University, Yokohama, Kanagawa, Japan; Hirotaka Osawa, Keio University, Yokohama, Kanagawa, Japan; Kazuhiko Shinozawa, ATR Intelligent Robotics and Communication Laboratories, Soraku-gun, Kyoto, Japan"
"CHI","12","http://dx.doi.org/10.1145/2207676.2208347","Uncomfortable interactions","1 ","99","622","622","control; discomfort; ethics; pain; rides; user interfaces; voyeurism","10","Steve Benford, The University of Nottingham, Nottingham, United Kingdom; Chris Greenhalgh, The University of Nottingham, Nottingham, United Kingdom; Gabriella Giannachi, The University of Exeter, Exeter, United Kingdom; Brendan Walker, The University of Nottingham, Nottingham, United Kingdom, ,; Joe Marshall, The University of Nottingham, Nottingham, United Kingdom"
"CHI","12","http://dx.doi.org/10.1145/2207676.2208348","Appreciating plei-plei around mobiles: playfulness in Rah island","0 ","37","176","176","ict4d; playfulness","10",""
"CHI","12","http://dx.doi.org/10.1145/2207676.2208350","I did that!  Measuring users' experience of agency in their own actions","0 ","41","292","292","\ cognitive science; \ experience of agency; personal agency","10","David Coyle, University of Bristol &#38; University of Cambridge, Bristol, United Kingdom; James Moore, University of Cambridge, Cambridge, Cambridgeshire, United Kingdom; Per Ola Kristensson, University of St Andrews, St Andrews, Fife, United Kingdom; Paul Fletcher, University of Cambridge, Cambridge, Cambridgeshire, United Kingdom"
"CHI","12","http://dx.doi.org/10.1145/2207676.2208351","The design space of opinion measurement interfaces: exploring recall support for rating and ranking","0 ","41","251","251","attitude; ranking; review","10","Syavash Nobarany, University of British Columbia, Vancouver, British Columbia, Canada; Louise Oram, University of British Columbia, Vancouver, British Columbia, Canada; Vasanth Kumar Rajendran, University of British Columbia, Vancouver, British Columbia, Canada; Chi-Hsiang Chen, University of British Columbia, Vancouver, British Columbia, Canada; Joanna McGrenere, University of British Columbia, Vancouver, British Columbia, Canada"
"CHI","12","http://dx.doi.org/10.1145/2207676.2208352","Assessing the vulnerability of magnetic gestural authentication to video-based shoulder surfing attacks","0 ","36","202","202","authentication; mobile phone; signature","4","Alireza Sahami Shirazi, University of Stuttgart, Stuttgart, Germany; Peyman Moghadam, Autonomous Systems Laboratory, CSIRO ICT Centre, Brisbane, Australia; Hamed Ketabdar, Quality and Usability Lab, Deutsche Telekom Laboratories &#38; TU Berlin, Berlin, Germany"
"CHI","12","http://dx.doi.org/10.1145/2207676.2208354","Reducing compensatory motions in video games for stroke rehabilitation","0 ","66","262","262","compensation; miscellaneous; video games","10","Gazihan Alankus, Washington University in St. Louis, St. Louis, Missouri, United States &#38; Izmir University of Economics, Izmir, Turkey"
"CHI","12","http://dx.doi.org/10.1145/2207676.2208355","Of BATs and APEs: an interactive tabletop game for natural history museums","1 ","51","271","271","design; evolution; human factors; learning; museums","10","Michael Horn, Northwestern University, Chicago, Illinois, United States; Zeina Atrash Leong, Northwestern University, Evanston, Illinois, United States; Florian Block, Harvard University, Cambridge, Massachusetts, United States; Judy Diamond, University of Nebraska State Museum, Lincoln, Nebraska, United States; E. Margaret Evans, University of Michigan, Ann Arbor, Michigan, United States; Brenda Phillips, Harvard University, Cambridge, Massachusetts, United States"
"CHI","12","http://dx.doi.org/10.1145/2207676.2208356","Playable character: extending digital games into the real world","0 ","57","379","379","design; games; miscellaneous","10","Jason Linder, California College of the Arts, San Francisco, California, United States"
"CHI","12","http://dx.doi.org/10.1145/2207676.2208357","Game design for promoting counterfactual thinking","0 ","47","264","264","alternate reality games; computers and education","4","Elizabeth Bonsignore, University of Maryland, College Park, Maryland, United States; Kari Kraus, University of Maryland, College Park, Maryland, United States; Amanda Visconti, University of Maryland, College Park, MD, United States; Derek Hansen, Brigham Young University, Provo, Utah, Unite States; Ann Fraistat, University of Maryland, College Park, Maryland, United States"
"CHI","12","http://dx.doi.org/10.1145/2207676.2208358","Discovery-based games for learning software","2 ","52","242","242","discovery learning; software training","4","Tao Dong, University of Michigan, Ann Arbor, Michigan, United States; Mira Dontcheva, Adobe Systems, San Francisco, California, United States; Diana Joseph, Adobe Systems, San Jose, California, United States; Karrie Karahalios, University of Illinois, Urbana, Illinois, United States; Mark Newman, University of Michigan, Ann Arbor, Michigan, United States"
"CHI","12","http://dx.doi.org/10.1145/2207676.2208360","Activity-based interaction: designing with child life specialists in a children's hospital","0 ","46","267","267","articulation work; children; group and organization interfaces; mobile computing","10","Matthew Bonner, Georgia Institute of Technology, Atlanta, Georgia, USA; Lan Wang, Georgia Institute of Technology, Atlanta, United States, Atlanta, Georgia, USA"
"CHI","12","http://dx.doi.org/10.1145/2207676.2208361","Adaptation as design: learning from an EMR deployment study","0 ","44","231","231","adaptation; design; implementations; workaround","10","Sun Young Park, University of California, Irvine, Irvine, California, United States"
"CHI","12","http://dx.doi.org/10.1145/2207676.2208363","What do users really care about?: a comparison of usability problems found by users and experts on highly interactive websites","0 ","106","588","588","expert evaluation; heuristics; user evaluation","10","Helen Petrie, University of York, York, North Yorkshire, United Kingdom"
"CHI","12","http://dx.doi.org/10.1145/2207676.2208364","The effect of task assignments and instruction types on remote asynchronous usability testing","0 ","48","283","283","asynchronous testing; instruction types; task assignments; user interfaces","10","Anders Bruun, Aalborg University, Aalborg, Denmark"
"CHI","12","http://dx.doi.org/10.1145/2207676.2208365","Analysis in practical usability evaluation: a survey study","1 ","89","484","484","analysis; questionnaire survey; usability evaluation method","10","Asbj&#248;rn F&#248;lstad, SINTEF, Oslo, Norway; Effie Law, University of Leicester, Leicester, United Kingdom"
"CHI","12","http://dx.doi.org/10.1145/2207676.2208366","Evaluating the collaborative critique method","0 ","57","285","285","complex systems; human-computer collaboration; user interfaces","28","Tamara Babaian, Bentley University, Waltham, Massachusetts, United States; Wendy Lucas, Bentley University, Waltham, Massachusetts, United States"
"CHI","12","http://dx.doi.org/10.1145/2207676.2208368","ZeroTouch: an optical multi-touch and free-air interaction architecture","3 ","78","943","943","free-air; multi-touch; user interfaces","10","Jon Moeller, Texas A&#38;M University, College Station, Texas, United States"
"CHI","12","http://dx.doi.org/10.1145/2207676.2208369","Enabling concurrent dual views on common LCD screens","0 ","46","382","382","dual-view display; miscellaneous","10","Seokhwan Kim, Microsoft Research Asia &#38; University of Tsukuba, Beijing, China; Xiang Cao, Microsoft Research Asia, Beijing, China; Haimo Zhang, Microsoft Research Asia &#38; National University of Singapore, Beijing, China"
"CHI","12","http://dx.doi.org/10.1145/2207676.2208370","Ultra-tangibles: creating movable tangible objects on interactive tables","1 ","48","410","410","actuated tabletops; tangible interface; user interface device","4","Mark Marshall, University of Bristol, Bristol, United Kingdom; Thomas Carter, University of Bristol, Bristol, United Kingdom; Jason Alexander, Lancaster University, Lancaster, United Kingdom"
"CHI","12","http://dx.doi.org/10.1145/2207676.2208371","CapStones and ZebraWidgets: sensing stacks of building blocks, dials and sliders on capacitive touch screens","1 ","43","275","275","capacitive sensing; tangible interface","4","Liwei Chan, Hasso Plattner Institut, Potsdam, Germany; Stefanie M&#252;ller, Hasso Plattner Institute, Potsdam, Germany; Anne Roudaut, Hasso Plattner Institut, Potsdam, Germany"
"CHI","12","http://dx.doi.org/10.1145/2207676.2208372","Brainput: enhancing interactive systems with streaming fnirs brain input","1 ","53","439","439","brain computer interface; human-robot interaction; multitasking","10","Erin Solovey, Massachusetts Institute of Technology, Cambridge, MA, USA; Paul Schermerhorn, Indiana University, Bloomington, Indiana, United States; Matthias Scheutz, Tufts University, Medford, Massachusetts, United States; Angelo Sassaroli, Tufts University, Medford, Massachusetts, United States; Sergio Fantini, Tufts University, Medford, Massachusetts, United States"
"CHI","12","http://dx.doi.org/10.1145/2207676.2208374","iRotate: automatic screen rotation based on face orientation","2 ","77","582","582","auto rotation; face detection","8","Lung-Pan Cheng, National Taiwan University, Taipei, Taiwan; Fang-I Hsiao, National Taiwan University, Taipei, Taiwan; Yen-Ting Liu, National Taiwan University, Taipei, Taiwan"
"CHI","12","http://dx.doi.org/10.1145/2207676.2208375","Looking at you: fused gyro and face tracking for viewing large imagery on mobile devices","0 ","46","351","351","mobile device; sensors; viewing large imagery","10","Neel Joshi, Microsoft Research, Redmond, Washington, United States; Abhishek Kar, IIT Kanpur, Kanpur, Uttar Pradesh, India &#38; Microsoft Research, Redmond, Washington, United States"
