"conference","year","doi","title","citationCount","download6weeks","download12months","downloadAll","keywords","pageNumber","authors"
"CHI","98","http://dx.doi.org/10.1145/274644.274709","Heart rate variability: indicator of user state as an aid to human-computer interaction","42 ","21","91","1,209","air traffic management; design; health; human factors; measurement; performance; user state","8","Dennis W. Rowe, The MITRE Corporation, 1820 Dolly Madison Boulevard, McLean, VA; John Sibert, The George Washington University, Washington, D.C."
"CHI","98","http://dx.doi.org/10.1145/274644.274710","Evolution of the conversation machine: a case study of bringing advanced technology to the marketplace","5 ","3","12","271","business; design; human factors; measurement; natural language processing; requirements; theory","8","Catherine G. Wolf, IBM T.J. Watson Research Center, 30 Saw Mill River Road, Hawthorne, NY"
"CHI","98","http://dx.doi.org/10.1145/274644.274711","Trust breaks down in electronic contexts but can be repaired by some initial face-to-face contact","63 ","15","144","1,620","cooperation and conflict; design; group and organization interfaces; management; performance; theory","7",""
"CHI","98","http://dx.doi.org/10.1145/274644.274712","Expertise, collaboration and bandwidth","4 ","3","19","342","cognitive models; computer conferencing, teleconferencing, and videoconferencing; design; group and organization interfaces; management; performance; theory","8","Alonso H. Vera, Dept. of Psychology, The University of Hong Kong, Pokfulam Road, Hong Kong; Thomas Kvan, Dept of Architecture, The University of Hong Kong, Pokfulam Road, Hong Kong; Robert L. West, Dept. of Psychology, The University of Hong Kong, Pokfulam Road, Hong Kong"
"CHI","98","http://dx.doi.org/10.1145/274644.274713","Effects of awareness support on groupware usability","40 ","7","60","1,128","design; groupware; management; performance; theory; workspace awareness","8","Carl Gutwin, Department of Computer Science, University of Saskatchewan, Saskatoon, SK, S7N 5A9, Canada"
"CHI","98","http://dx.doi.org/10.1145/274644.274714","Composing magic lenses","1 ","3","19","406","clos; design; human factors; lens; management; object-oriented programming; performance; scheme; transparent; work-through interface","7",""
"CHI","98","http://dx.doi.org/10.1145/274644.274715","Generalized pointing: enabling multiagent interaction","5 ","4","12","240","algorithm design and analysis; design; interaction styles; management; performance","8","Dan R. Olsen, Jr., Human-Computer Interaction Institute, Carnegie-Mellon University, Pittsburgh, PA; Daniel Boyarski, Human-Computer Interaction Institute, Carnegie-Mellon University, Pittsburgh, PA; Thom Verratti, Human-Computer Interaction Institute, Carnegie-Mellon University, Pittsburgh, PA; Matthew Phelps, Human-Computer Interaction Institute, Carnegie-Mellon University, Pittsburgh, PA; Jack L. Moffett, Human-Computer Interaction Institute, Carnegie-Mellon University, Pittsburgh, PA"
"CHI","98","http://dx.doi.org/10.1145/274644.274716","Scripting graphical applications by demonstration","5 ","8","18","275","amulet; design; human factors; performance; scripting; theory; user interface development environments","8",""
"CHI","98","http://dx.doi.org/10.1145/274644.274717","Illuminating light: an optical design tool with a luminous-tangible interface","72 ","12","65","1,165","augmented reality; elicitation methods; engineering simulation; human factors; luminous interface; performance; reliability; tangible interface","8","John Underkoffler, MIT Media Laboratory, Cambridge, MA"
"CHI","98","http://dx.doi.org/10.1145/274644.274718","Insight lab: an immersive team environment linking paper, displays, and data","22 ","6","28","545","analysis methods; collaboration; digital documents; group memory; hybrid paper electronic interfaces; management; multimedia information systems; programming environments; theory","8",""
"CHI","98","http://dx.doi.org/10.1145/274644.274719","Reinventing the familiar: exploring an augmented reality design space for air traffic control","43 ","8","57","773","aerospace; command and control; design space; human factors; management; performance; theory","8",""
"CHI","98","http://dx.doi.org/10.1145/274644.274720","Designing audio aura","69 ","12","45","1,269","active badge; audio input/output; augmented reality; design; human factors; performance; sound and music computing; user/machine systems","8","Elizabeth D. Mynatt, Xerox Palo Alto Research Center; Maribeth Back, Xerox Palo Alto Research Center; Roy Want, Xerox Palo Alto Research Center; Michael Baer, Stanford University"
"CHI","98","http://dx.doi.org/10.1145/274644.274721","Communicating graphical information to blind users using music: the role of context","26 ","3","37","942","assistive technologies for persons with disabilities; blind users; empirical; human factors; music; theory","8","James L. Alty, LUTCHI Research Centre, Dept. of Computer Science, Loughborough University, Loughborough, Leicestershire, LE11 3TU, UK"
"CHI","98","http://dx.doi.org/10.1145/274644.274722","What can I say?: evaluating a spoken language interface to Email","24 ","10","25","589","design; email interfaces; experimentation; initative; measurement; natural language interfaces; spoken language interfaces","8","Marilyn A. Walker, ATT Labs Research, 180 Park Ave., D188, Florham Park N.J.; Jeanne Fromer, ATT Labs Research, 180 Park Ave., D188, Florham Park N.J.; Giuseppe Di Fabbrizio, ATT Labs Research, 180 Park Ave., D188, Florham Park N.J.; Craig Mestel, ATT Labs Research, 180 Park Ave., D188, Florham Park N.J."
"CHI","98","http://dx.doi.org/10.1145/274644.274723","Device design methodology for trauma applications","1 ","4","16","342","design; field studies; healthcare; human factors; medicine and science; theory","5",""
"CHI","98","http://dx.doi.org/10.1145/274644.274724","Voice-enabled structured medical reporting","2 ","4","30","440","clinical reporting; dictation; health; languages; medical information systems; sgml; structured reporting; voice recognition","8","Mary-Marshall Teel, Lernout & Hauspie Speech Products, 54 Third Avenue, Burlington, MA; Rachael Sokolowski, Lernout & Hauspie Speech Products, 54 Third Avenue, Burlington, MA"
"CHI","98","http://dx.doi.org/10.1145/274644.274725","Interactive storytelling environments: coping with cardiac illness at Boston's Children's Hospital","14 ","9","35","821","authoring environments; computational play kits; design; human factors; management; performance; theory","8","Marina Umaschi Bers, MIT Media Laboratory, 20 Ames Street, E15-320, Cambridge MA; Edith Ackermann, MERL-A Mistubishi, Electric Research Laboratory, 201 Broadway, 8th floor, Cambridge MA; Justine Cassell, MIT Media Laboratory, 20 Ames Street, E15-320, Cambridge MA; Beth Donegan, Children's Hospital, 300 Longwood Avenue, Boston MA; Joseph Gonzalez-Heydrich, Children's Hospital, 300 Longwood Avenue, Boston MA; David Ray DeMaso, Children's Hospital, 300 Longwood Avenue, Boston MA; Carol Strohecker, MERL-A Mistubishi, Electric Research Laboratory, 201 Broadway, 8th floor, Cambridge MA; Sarah Lualdi, Children's Hospital, 300 Longwood Avenue, Boston MA; Dennis Bromley, MERL-A Mistubishi, Electric Research Laboratory, 201 Broadway, 8th floor, Cambridge MA"
"CHI","98","http://dx.doi.org/10.1145/274644.274726","Progressive design: staged evolution of scenarios in the design of a collaborative science learning environment","1 ","5","21","588","claims; computer-supported collaborative learning; group and organization interfaces; management; performance; task-artifact framework; user/machine systems","8","George Chin, Jr., Computer Science Department, Virginia Polytechnic Institute and State University, Blacksburg, VA"
"CHI","98","http://dx.doi.org/10.1145/274644.274727","Adapting user interface design methods to the design of educational activities","7 ","8","26","838","analysis methods; computer uses in education; design techniques; end user programming; management; task analysis; user interfaces","8","Clayton Lewis, Department of Computer Science and Institute of Cognitive Science, University of Colorado, Boulder, CO; Cathy Brand, Department of Computer Science and Institute of Cognitive Science, University of Colorado, Boulder, CO; Gina Cherry, Department of Computer Science and Institute of Cognitive Science, University of Colorado, Boulder, CO"
"CHI","98","http://dx.doi.org/10.1145/274644.274728","The progress portfolio: designing reflective tools for a classroom context","6 ","9","38","793","children; computer uses in education; education applications; human factors; learner-centered design; performance","8","Ben Loh, School of Education and Social Policy, Northwestern University, 2115 N Campus Drive, Evanston, IL; Josh Radinsky, School of Education and Social Policy, Northwestern University, 2115 N Campus Drive, Evanston, IL; Eric Russell, School of Education and Social Policy, Northwestern University, 2115 N Campus Drive, Evanston, IL; Louis M. Gomez, School of Education and Social Policy, Northwestern University, 2115 N Campus Drive, Evanston, IL; Brian J. Reiser, School of Education and Social Policy, Northwestern University, 2115 N Campus Drive, Evanston, IL"
